{
  "version": 1,
  "templateId": "F1",
  "locale": "ru",
  "palette": "porcelain",
  "content": {
    "title": "Выручка растёт во всех тарифах",
    "subtitle": "Сравнение за первое полугодие, млн ₽",
    "source": "Внутренняя отчётность"
  },
  "payload": {
    "categories": ["Базовый", "Командный", "Бизнес"],
    "series": [
      {"name": "Прошлый год", "values": [12, 18, 26]},
      {"name": "Текущий год", "values": [16, 25, 34]}
    ]
  }
}
