{
  "version": 1,
  "templateId": "R04",
  "locale": "ru",
  "palette": "wire",
  "content": {
    "eyebrow": "Ежемесячный обзор",
    "period": "Август 2026",
    "title": "Команда ускорила выпуск обновлений",
    "subtitle": "Главные показатели и динамика за четыре недели",
    "source": "Внутренняя аналитика"
  },
  "payload": {
    "kpis": [
      {"label": "Обновлений", "value": "48"},
      {"label": "Медиана цикла", "value": "3,2 дня"},
      {"label": "Без отката", "value": "96%"}
    ],
    "sections": [
      {"title": "Главный вывод", "text": "Частота выпусков выросла, а доля откатов осталась ниже целевого уровня."},
      {"title": "Следующий шаг", "text": "Сократить время ожидания ревью в двух самых загруженных направлениях."}
    ],
    "categories": ["Неделя 1", "Неделя 2", "Неделя 3", "Неделя 4"],
    "series": [
      {"name": "Обновления", "values": [9, 11, 13, 15]},
      {"name": "Откаты", "values": [1, 0, 1, 0]}
    ]
  }
}
